France,Advertising Agencies,Communication Services,PAR,Publicis Groupe S.A.,PUB.PA,EUR,EUR,106.75,107.0,105.75,107.4,106.75,105.95,86.82,109.3,102.2898,100.26935,391584.0,440771,556277,26816792576,250991008,0.63639,1.7473638,28711354368,0.09526,2.6818032,1.871,11.189,3.4,0.0332,0.59029996,2.68,3.4,0.241,1462000000,6.55,7.73,0.24,0.077,0.43278998,0.1672,0.14026,0.041079998,0.15469,3081999872,12.279,5543000064,56.132,39.507,0.87,0.894,6641999872,1400499968.0,1555000064.0,142.0,100.0,119.28571,118.0,2.0,buy,14.0,,,0.10370135,0.996,16.175571,12.564751,2.3109,"Publicis est un leader mondial de la communication et du marketing digital, spécialisé dans la publicité, les médias, le conseil en transformation digitale et l’activation des données clients. Son modèle repose sur l’intégration des données, de la technologie et de la créativité pour offrir des solutions marketing adaptées aux grandes marques.
En 2024, Publicis a réalisé un chiffre d’affaires net de 9,4 milliards d’euros (+5,3 % en organique), avec une marge opérationnelle de 17,8 %. Le groupe est structuré en trois grandes divisions. Epsilon et Publicis Sapient (32 % des revenus) génèrent une croissance rapide grâce à l’exploitation des données et du cloud marketing. Les services médias et créatifs (46 %) restent dominants avec des marques comme Saatchi & Saatchi et Leo Burnett. Le conseil et la transformation digitale (22 %) se développent fortement avec Sapient, offrant des services liés à l’IA générative et à l’automatisation du marketing.
Géographiquement, Publicis réalise 57 % de son chiffre d’affaires en Amérique du Nord, 30 % en Europe et 13 % dans le reste du monde. La croissance est portée par l’essor des investissements publicitaires numériques, l’adoption de l’IA marketing et l’expansion des services technologiques. Le groupe continue d’acquérir des entreprises spécialisées dans la data et l’intelligence artificielle pour renforcer son offre face à la concurrence de Google et Meta.
Risque principal : Publicis est exposé à la volatilité des budgets publicitaires des entreprises, à la concurrence accrue des plateformes numériques et aux évolutions réglementaires sur l’exploitation des données. "
United States,Semiconductors,Technology,NMS,QUALCOMM Incorporated,QCOM,USD,USD,167.96,169.67,169.0,171.8,167.96,171.36,148.41,230.63,162.0342,175.63284,5895161.0,8090701,9552500,189524164608,1106000000,0.80716,4.8643336,197520457728,0.2603,7.259171,5.07,16.516,3.4,0.019299999,0.3614,2.16,0.85,0.96,10110000128,9.27,12.23,0.941,0.187,0.56214,0.30694,0.2625,0.12069,0.42253,13299999744,11.971,15440000000,58.765,23.606,1.64,2.402,21902000128,8920500224.0,12202000384.0,270.0,160.0,200.99419,190.0,2.15385,buy,31.0,2:1,1092614400.0,0.0970608,1.286,18.485435,13.961025,1.689,"Qualcomm est un acteur majeur des semi-conducteurs et des technologies de communication, spécialisé dans les processeurs mobiles, l’intelligence artificielle embarquée, la connectivité 5G et l’Internet des objets (IoT). Son modèle repose sur l’innovation en microprocesseurs, l’extension de ses solutions vers l’automobile et l’IoT, ainsi que la monétisation de son portefeuille de brevets via ses licences. En 2024, Qualcomm a réalisé un chiffre d’affaires de 38,9 milliards de dollars (+9 % vs 2023) avec une croissance du résultat net de 21 % et un free cash-flow record de 11,2 milliards de dollars. Le groupe est structuré en deux principales divisions. QCT (85 % des revenus, 33,2 milliards de dollars) regroupe la vente de puces pour smartphones, IoT et automobiles, avec une forte croissance des revenus automobiles (+55 %). QTL (15 % des revenus, 5,6 milliards de dollars) gère les licences de brevets et la propriété intellectuelle liée aux communications sans fil, avec une marge bénéficiaire de 74 %.
Géographiquement, Qualcomm est fortement présent en Amérique du Nord, en Asie et en Europe, bénéficiant de l’adoption de ses solutions dans les smartphones (Snapdragon), les PC (Snapdragon X), les véhicules connectés et les infrastructures 5G. L’entreprise accélère également sur l’IA embarquée, avec des processeurs dédiés comme Snapdragon 8 Elite et Qualcomm Oryon, ciblant les véhicules autonomes, les casques XR et les assistants IA.
Risque principal : Qualcomm est exposé à la concurrence accrue des semi-conducteurs (Apple, MediaTek, Nvidia), à la dépendance aux ventes de smartphones premium, aux tensions géopolitiques entre les États-Unis et la Chine et aux évolutions réglementaires sur les brevets et licences. Son modèle nécessite une capacité constante à innover et à diversifier ses sources de revenus."
Switzerland,Drug Manufacturers - General,Healthcare,EBS,Roche Holding AG,ROG.SW,CHF,CHF,289.0,288.7,286.2,290.6,289.0,290.6,212.9,292.1,264.404,261.31,1248673.0,1086835,1194318,233606660096,690097984,0.38664,3.8561044,258539257856,0.17528999,8.000441,4.268,12.287,9.6,0.0337,0.72510004,3.16,9.7,-0.123,10618999808,13.24,20.49,-0.121,0.005,0.74538004,0.34732,0.35268003,0.12488,0.36356,8814000128,11.062,36174999552,110.035,36.323,0.801,1.264,45155999744,8125374976.0,16110999552.0,448.0,230.0,307.3405,292.0,2.68421,hold,19.0,100:1,988934400.0,0.2703297,0.145,21.94864,13.127337,1.4066,"Roche est un leader mondial de l’industrie pharmaceutique et du diagnostic, opérant un modèle intégré qui combine le développement de médicaments innovants et des solutions de diagnostic avancées. Son modèle repose sur une forte R&D, l’expansion de son portefeuille de traitements et le développement de solutions personnalisées basées sur les biomarqueurs.
En 2024, Roche a généré un chiffre d’affaires de 60,5 milliards de CHF (+7 % à taux de change constants), porté par une croissance de +9 % en pharmacie et +8 % en diagnostic hors impact COVID-19. Le groupe est structuré en deux divisions. Pharmaceuticals (76 % des revenus, 46,2 milliards CHF) est porté par les succès de Vabysmo (+68 %), Hemlibra (+12 %), Ocrevus (+9 %) et Polivy (+39 %), avec un total de 17 médicaments blockbusters. Diagnostics (24 % des revenus, 14,3 milliards CHF) affiche une forte croissance en immunodiagnostic, tests moléculaires et pathologie.
Géographiquement, Roche est bien diversifié avec 41 % des revenus en Europe, 36 % aux États-Unis, 12 % en Chine et 11 % dans d’autres régions. L’entreprise poursuit ses investissements en oncologie, neurosciences, immunologie et thérapies innovantes, avec plusieurs traitements prometteurs en phase avancée, notamment dans la sclérose en plaques, Alzheimer et les maladies rares.
Risque principal : Roche est exposé à la perte d’exclusivité de plusieurs médicaments clés (1,2 milliard CHF en 2025), à la pression réglementaire sur les prix des médicaments et à la complexité des essais cliniques pour les nouvelles thérapies. Son modèle nécessite une innovation continue et une gestion stratégique des brevets pour maintenir sa croissance."
United Kingdom,Aerospace & Defense,Industrials,LSE,Rolls-Royce Holdings plc,RR.L,GBp,GBP,602.8,603.0,598.2,614.8,602.8,613.4,300.5,624.8,583.676,512.954,27721221.0,25222998,30699174,52446007296,8504900096,0.65199,2.9424376,51516641280,0.13083,,2.89,20.354,,,,1.74,1.578574,-0.065,2332000000,0.28,20.87,-0.071,0.178,0.22986001,0.142,0.13328,0.04605,,4336000000,0.517,5282999808,,-0.274,0.74,1.277,4096999936,1088375040.0,3228999936.0,830.0,240.00002,611.529,640.0,2.05882,buy,17.0,,,0.9501779,1.81,21.907145,2882.6543,0.5376,"Rolls-Royce est un acteur majeur de l’industrie aéronautique, de la défense et des systèmes énergétiques, spécialisé dans la fabrication de moteurs d’avions, les solutions énergétiques et les réacteurs nucléaires. Son modèle repose sur une intégration verticale forte, des technologies différenciées et des revenus récurrents grâce aux contrats de maintenance à long terme (LTSA).
En 2024, Rolls-Royce a réalisé un chiffre d’affaires de 15,4 milliards de livres sterling (+21 % vs 2023), avec un résultat opérationnel de 2,1 à 2,3 milliards de livres et un cash-flow libre attendu entre 2,1 et 2,2 milliards de livres. Le groupe est structuré en trois divisions principales. Civil Aerospace (48 % des revenus, 7,3 milliards £) bénéficie d’une forte demande pour ses moteurs Trent XWB et Pearl, avec une croissance du trafic aérien et des services de maintenance. Defence (26 % des revenus, 4,1 milliards £) repose sur les contrats gouvernementaux pour les moteurs de sous-marins, avions de combat et transport militaire. Power Systems (26 % des revenus, 4,0 milliards £) se concentre sur les solutions énergétiques pour l’industrie et les infrastructures, notamment les batteries et systèmes hybrides.
Géographiquement, Rolls-Royce réalise 37 % de son chiffre d’affaires en Europe, 31 % en Amérique du Nord, 26 % en Asie et 6 % dans le reste du monde. L’entreprise investit dans la décarbonation avec des moteurs compatibles 100 % SAF, les petits réacteurs nucléaires (SMR) et les solutions hybrides électriques pour réduire son empreinte carbone.
Risque principal : Rolls-Royce est exposé à la volatilité des cycles aéronautiques, à la dépendance aux contrats militaires et aux régulations énergétiques, ainsi qu’à des défis de rentabilité sur ses nouvelles technologies (SMR, batteries, moteurs à hydrogène). La réduction de sa dette nette et l’optimisation des coûts restent des priorités pour améliorer sa compétitivité."
France,Building Products & Equipment,Industrials,PAR,Compagnie de Saint-Gobain S.A.,SGO.PA,EUR,EUR,93.58,93.52,92.4,93.9,93.58,93.58,67.09,94.36,87.2884,81.725,842594.0,1093621,1115995,46509260800,497000000,0.54316,1.0011896,56656846848,0.061979998,1.9510466,1.22,8.667,2.1,0.0224,0.3691,3.1,2.1,0.145,2879000064,5.69,6.94,0.163,-0.06,0.27257,0.14072,0.11472999,0.05445,0.124139994,8169999872,16.354,17613000704,72.108,47.964,0.944,1.411,12661999616,3475749888.0,5858999808.0,147.0,72.0,99.85294,99.0,1.88235,buy,17.0,4:1,1025136000.0,0.3534857,1.37,16.446398,13.670235,1.5344,"Saint-Gobain est un leader mondial des matériaux de construction et des solutions pour l’habitat durable, opérant dans la fabrication, la distribution et les solutions innovantes pour le bâtiment et l’industrie. Son modèle repose sur la transition vers une construction bas carbone, la rénovation énergétique et l’expansion vers les marchés émergents.
En 2024, le groupe a généré un chiffre d’affaires de 35 milliards d’euros (-3,9 % en organique vs 2023) avec une marge opérationnelle record de 11,7 %. Les revenus sont répartis en quatre segments. Europe, Moyen-Orient & Afrique (54 % des revenus, 18,9 milliards €) a connu une contraction des volumes, particulièrement en France et en Allemagne. Amériques (21 % des revenus, 7,5 milliards €) affiche une croissance en Amérique du Nord (+2,7 %), tandis que l’Amérique latine est en recul. Asie-Pacifique (5 % des revenus, 1,8 milliard €) bénéficie d’une forte dynamique en Inde (+6 %). Solutions Haute Performance (21 % des revenus, 7,4 milliards €) maintient une croissance stable grâce à l’industrie et la mobilité.
Saint-Gobain investit dans la croissance externe avec l’acquisition de CSR en Australie et de Fosroc dans les matériaux de construction chimiques, consolidant son leadership dans les marchés en expansion. 
Risque principal : Saint-Gobain est exposé à la cyclicité des marchés de la construction, aux fluctuations des coûts des matières premières et de l’énergie, ainsi qu’à la sensibilité aux réglementations environnementales et aux aides publiques en rénovation. L’entreprise doit également gérer l’intégration des acquisitions et l’optimisation de ses coûts de production pour préserver sa rentabilité."
Germany,Specialty Industrial Machinery,Industrials,GER,Siemens Aktiengesellschaft,SIE.DE,EUR,EUR,207.45,207.55,206.55,212.2,207.45,211.15,150.68,212.2,195.7976,179.7306,1937400.0,1122127,1250760,165376262144,783217024,0.41085,2.1034617,195002515456,0.103269994,3.3460104,2.48,16.466,4.7,0.0251,0.4714,3.1,5.2,0.549,7975000064,10.27,8.49,0.56,0.042,0.38854998,0.15063,0.13825,0.040799998,0.16410999,7758000128,9.83,49901998080,91.117,63.105,0.79,1.404,30548000768,3409625088.0,11352000512.0,285.0,130.0,215.83136,216.495,1.72727,buy,22.0,,,0.25620687,1.216,20.559881,17.431223,2.3157,"Siemens est un leader mondial de la technologie industrielle, spécialisé dans l’automatisation, l’électrification et la digitalisation. Son modèle repose sur l’IA industrielle, les infrastructures énergétiques intelligentes et la mobilité durable.
En 2024, Siemens a réalisé un chiffre d’affaires de 75,9 milliards d’euros (+3 % vs 2023) et un EBIT de 11,4 milliards d’euros, avec une marge opérationnelle de 15,5 %. Les trois divisions principales sont Digital Industries (25 % des revenus), qui bénéficie de la croissance du numérique (+14 %), Smart Infrastructure (31 %), porté par les solutions énergétiques intelligentes, et Mobility (15 %), en progression avec les commandes ferroviaires.
Géographiquement, Siemens répartit ses revenus entre Asie-Pacifique (46 %), Amérique du Nord (31 %) et Europe (22 %). L’entreprise renforce son portefeuille avec l’acquisition d’Altair Engineering pour 10,6 milliards de dollars, consolidant sa position dans les logiciels de simulation et jumeaux numériques.
Risque principal : Siemens est exposé aux cycles industriels, aux tensions géopolitiques et à la concurrence accrue dans l’IA et le cloud industriel. Son succès repose sur l’innovation continue et l’optimisation de ses investissements."
France,Integrated Freight & Logistics,Industrials,PAR,STEF SA,STF.PA,EUR,EUR,136.4,137.0,136.9,137.8,136.4,137.0,114.2,147.0,131.472,132.061,1627.0,2786,2530,1717733376,12538200,0.122930005,0.37438247,2999616512,0.03592,1.4363899,0.654,7.898,5.1,0.0374,0.3932,2.76,5.1,-0.283,163596000,12.97,14.99,-0.279,0.067,0.11056,0.082770005,0.04322,0.04221,0.14362,141702000,11.342,1437078016,120.59,95.378,0.662,0.725,507264000,-42118752.0,311043008.0,166.0,152.6,158.65,158.0,1.25,strong_buy,4.0,4:1,1135814400.0,0.12913907,0.879,10.562837,9.794459,,"STEF est le leader européen du transport et de la logistique sous température dirigée, opérant sur les segments des produits frais, surgelés et secs. Son modèle repose sur une intégration verticale, une couverture géographique étendue et une expertise en logistique agroalimentaire.
En 2024, STEF a réalisé un chiffre d’affaires de 2,33 milliards d’euros (+6,7 % vs 2023), avec une marge opérationnelle en baisse à 5,2 % en raison de l’intégration de nouvelles acquisitions et d’une consommation alimentaire atone. La répartition des revenus montre une dynamique contrastée : France (1,17 milliard €, +1,5 %), International (858,9 millions €, +19,1 %), avec une forte progression en Italie et en Espagne grâce aux acquisitions de Transwest (Belgique) et Bakker (Pays-Bas).
Le groupe poursuit sa croissance externe, notamment avec les acquisitions récentes de Montfrisa (Espagne), TDL Fresh Logistics (Belgique) et Long Lane Deliveries (Écosse), renforçant son maillage territorial en Europe du Nord. Parallèlement, STEF investit dans la décarbonation de sa flotte via l’intégration de véhicules électriques, au biogaz et à l’hydrogène.
Risque principal : STEF est exposé à la faiblesse de la consommation alimentaire, à la hausse des coûts d’exploitation (salaires, énergie, matériel roulant) et aux taux d’intérêt élevés, impactant ses capacités d’investissement. Son modèle repose sur l’optimisation de son réseau logistique et la montée en puissance des synergies avec ses acquisitions."
Switzerland,Medical Instruments & Supplies,Healthcare,EBS,Straumann Holding AG,STMN.SW,CHF,CHF,126.4,126.5,124.9,126.9,126.4,125.1,103.75,151.5,120.205,119.508,250320.0,286402,277843,19946319872,159443008,0.37974,7.849226,20271638528,0.10651,10.132015,7.977,29.062,0.85,0.0067000003,0.4722,0.58,0.85,0.12,287880992,1.79,3.65,0.118,0.113,0.72689,0.27449,0.26563,0.10905,0.14982,333665984,2.093,453571008,23.007,12.347,1.294,2.111,1847159040,155048624.0,503340000.0,175.0,90.0,132.05263,140.0,2.52381,hold,19.0,10:1,1650412800.0,-0.096820295,1.252,69.88827,34.202007,1.0755,"Straumann est un leader mondial des solutions dentaires, spécialisé dans l’implantologie, l’orthodontie numérique et la restauration dentaire. Son modèle repose sur l’innovation technologique, la digitalisation des soins dentaires et l’expansion des marchés émergents.
En 2024, Straumann a généré un chiffre d’affaires de 1,9 milliard CHF sur les neuf premiers mois (+14,5 % en organique), avec une rentabilité stable dans une fourchette de 27-28 %. Le groupe est structuré autour de trois segments : Implantologie (50 % du marché premium), Orthodontie numérique (ClearCorrect), et CADCAM (prothèses et équipements de fabrication dentaire).
Géographiquement, la croissance est tirée par l’Asie-Pacifique (+19,7 %), l’Amérique latine (+18,9 %) et l’Europe (+11,4 %), tandis que l’Amérique du Nord progresse plus lentement (+2,0 %). Straumann accélère dans le numérique avec le lancement global du scanner intraoral SIRIOS et investit dans de nouvelles usines en Chine et au Brésil pour soutenir sa production.
Risque principal : Straumann est exposé à la sensibilité des dépenses de santé aux cycles économiques, à une forte concurrence dans l’orthodontie numérique (Invisalign) et aux fluctuations des devises impactant ses marges. Son succès repose sur l’innovation continue et l’adoption croissante des solutions digitales dans les soins dentaires."
Japan,Conglomerates,Industrials,JPX,Sumitomo Corporation,8053.T,JPY,JPY,3380.0,3374.0,3315.0,3379.0,3380.0,3327.0,2675.5,4433.0,3328.62,3538.89,2521600.0,2877293,3197780,4089714835456,1209980032,0.35456002,0.57723993,7469144735744,0.05017,0.91449714,1.054,13.838,130.0,0.039300002,0.4363,4.7,65.0,-0.179,355221995520,323.72,443.29,-0.171,0.044,0.19573,0.07618,0.05291,0.023599999,0.0868,692540014592,572.357,3693828112384,80.178,3638.065,0.967,1.766,1386704011264,179479871488.0,464457990144.0,5200.0,3500.0,3982.0,3670.0,2.1,buy,10.0,,,-0.015725076,0.68,10.2774,7.5052447,,"Sumitomo Corporation est un conglomérat japonais diversifié, actif dans les métaux, les infrastructures, l’automobile, l’énergie, les télécommunications et les services financiers. Son modèle repose sur une gestion active du portefeuille d’actifs, des investissements stratégiques et une forte présence internationale.
En 2024, le groupe a généré un bénéfice net de 254 milliards de yens sur le premier semestre (-11 % vs 2023), tout en maintenant un objectif annuel de 530 milliards de yens. Son activité est segmentée en ressources minérales (20 % des revenus), transformation énergétique (23 %), infrastructures et construction (16 %), automobile (9 %), médias & digital (8 %), immobilier et services urbains (7 %).
Géographiquement, Sumitomo est bien diversifié avec 34 % des revenus en Asie, 30 % en Amérique du Nord, 22 % en Europe et 14 % dans d’autres régions. Le groupe continue d’investir massivement dans la transition énergétique, avec des projets d’énergies renouvelables en Europe et en Asie, ainsi qu’une entrée sur le marché du gaz naturel en Inde. Il a également renforcé sa présence dans la distribution d’équipements de construction en Afrique avec l’acquisition de BIA Group.
Risque principal : Sumitomo est exposé à la volatilité des prix des matières premières, aux fluctuations monétaires et aux tensions géopolitiques. La gestion de son portefeuille d’investissements, notamment dans l’énergie et les infrastructures, sera clé pour atteindre ses objectifs de croissance à horizon 2026."
France,Oil & Gas Equipment & Services,Energy,PAR,Technip Energies N.V.,TE.PA,EUR,EUR,27.8,27.8,27.8,28.48,27.8,28.48,18.33,28.48,26.1028,23.03545,371035.0,322420,227985,5015356416,174344992,0.73697,0.7818658,2688441600,0.056560002,2.537872,0.419,5.45,0.57,0.020499999,0.2908,,0.57,0.079,362800000,1.96,2.38,0.074,0.131,0.15207,0.0769,0.07698,0.03629,0.20376,3320100096,18.358,980700032,48.32,11.222,0.878,1.031,975500032,276875008.0,555400000.0,37.0,25.0,29.84615,29.0,1.84615,buy,13.0,,,0.49582994,0.678,14.530612,12.181664,,"Technip Energies est un leader de l’ingénierie et des technologies énergétiques, spécialisé dans le gaz naturel liquéfié (GNL), la transition énergétique, le captage du carbone et l’hydrogène. Son modèle repose sur la gestion de grands projets d’infrastructures énergétiques, l’innovation technologique et une diversification vers les énergies bas carbone.
En 2024, Technip Energies a réalisé un chiffre d’affaires de 5,0 milliards d’euros (+13 % vs 2023) et un carnet de commandes en progression à 15,9 milliards d’euros. Ses revenus sont répartis en Project Delivery (70 % des revenus, en forte croissance grâce aux projets LNG) et Technology, Products & Services (30 %), porté par l’essor des carburants renouvelables et de la captation du CO₂. Le groupe a consolidé son portefeuille avec des contrats clés aux États-Unis, en Inde et au Royaume-Uni, dont la FEED du projet Exxon Rovuma LNG et un EPFC pour un terminal GNL à Lake Charles. Il a également réalisé deux acquisitions en Italie pour renforcer son expertise en ingénierie des procédés et conception de pipelines.
Risque principal : Technip Energies est exposé à la volatilité des investissements dans l’énergie, aux délais d’approbation des grands projets et à la concurrence croissante dans le secteur des énergies renouvelables et du captage du carbone. Son modèle repose sur une exécution rigoureuse des projets et une montée en puissance des solutions bas carbone."
United States,Software - Infrastructure,Technology,NMS,"Tenable Holdings, Inc.",TENB,USD,USD,40.23,40.79,40.05,41.0,40.23,40.85,35.25,52.5,41.5596,41.9022,1180166.0,1017008,1559870,4889662976,119698000,0.92999,5.5716558,5052345856,-0.06816,12.1037035,5.757,335.437,,,,,,,-59817000,-0.31,1.45,,0.127,0.77549005,0.01716,-0.00759,-0.00696,-0.15989,548449024,4.565,409744992,101.283,3.375,1.128,1.284,680563968,190431504.0,174862000.0,55.0,40.0,49.19789,50.0,2.04348,buy,19.0,,,-0.20572555,0.832,,22.716404,,"Tenable est un acteur singulier de la cybersécurité, spécialisé dans la gestion des vulnérabilités et la sécurisation des environnements IT, cloud et OT (technologies opérationnelles). Son modèle repose sur une approche unifiée de l'exposition aux menaces, combinant analytique avancée, intelligence artificielle et automatisation des processus de sécurité.
En 2024, Tenable a réalisé un chiffre d’affaires de 227,1 millions de dollars au troisième trimestre (+13 % vs 2023), avec 96 % de revenus récurrents et une marge brute de 81 %. Son portefeuille de solutions comprend Tenable One, Tenable Vulnerability Management, Tenable Cloud Security et Tenable OT Security, permettant une couverture complète des risques sur les infrastructures cloud, on-premises et industrielles. L’entreprise détient la première place mondiale en gestion des vulnérabilités selon IDC et Forrester. Tenable bénéficie d’une forte présence dans les grandes entreprises, avec 65 % des sociétés du Fortune 500 et 50 % des entreprises du Global 2000 parmi ses clients. Son marché adressable est estimé à 33 milliards de dollars en 2027, porté par la croissance de la gestion des cyber-risques, des environnements cloud et des actifs critiques.
Risque principal : Tenable est exposé à la concurrence croissante des acteurs spécialisés en cybersécurité (Palo Alto Networks, CrowdStrike, Microsoft), aux évolutions réglementaires sur la protection des données et à la nécessité d’une innovation continue pour faire face aux nouvelles menaces. Son modèle repose sur l’expansion de ses solutions SaaS et l’intégration avancée de l’IA dans ses analyses de risques."
