Pays,Industrie,Secteur,Bourse,Nom complet,Ticker,Devise,Devise financière,Clôture précédente,Prix d’ouverture,Plus bas du jour,Plus haut du jour,Clôture précédente marché régulier,Prix actuel,Plus bas sur 52 semaines,Plus haut sur 52 semaines,Moyenne sur 50 jours,Moyenne sur 200 jours,Volume,Volume moyen,Volume moyen 10 jours,Capitalisation boursière,Actions en circulation,Pourcentage détenu institutions,Ratio cours/ventes TTM,Valeur d’entreprise,Marges bénéficiaires,Ratio cours/valeur comptable,Valeur entreprise / chiffre d’affaires,Valeur entreprise / EBITDA,Taux de dividende,Rendement du dividende,Ratio de distribution,Rendement moyen 5 ans,Valeur dernier dividende,Croissance trimestrielle bénéfices,Bénéfice net actions ordinaires,BPA historique,BPA prévisionnel,Croissance bénéfices,Croissance chiffre d’affaires,Marges brutes,Marges EBITDA,Marges opérationnelles,Rendement actifs,Rendement capitaux propres,Trésorerie totale,Trésorerie par action,Dette totale,Ratio dette/capitaux propres,Valeur comptable,Ratio liquidité immédiate,Ratio liquidité courante,Bénéfice brut,Flux de trésorerie dispo,Flux de trésorerie exploitation,Objectif prix élevé,Objectif prix bas,Prix cible moyen,Prix cible médian,Moyenne des recommandations,Recommandation clé,Nombre d’avis analystes,Dernier split,Date dernier split,Variation 52 semaines,Bêta,PER historique,PER prévisionnel,Ratio PEG historique,Business_models
Netherlands,Semiconductor Equipment & Materials,Technology,AMS,ASML Holding N.V.,ASML.AS,EUR,EUR,701.5,708.4,706.3,719.3,701.5,717.0,605.7,1021.8,699.928,773.4675,705973.0,765979,1077408,286857363456,393200000,0.5277,10.933272,268066701312,0.26399,17.455023,10.217,30.237,6.24,0.0097,0.3506,0.85,1.84,0.097,6926300160,19.26,24.18,0.098,0.119,0.51147,0.3379,0.32692,0.12707,0.49216,4984500224,12.677,4692199936,29.051,41.077,0.728,1.551,13419499520,524100000.0,4818400256.0,1057.0,500.0,842.2258,850.0,1.78947,buy,31.0,77:100,1353888000.0,-0.19895166,1.104,37.227413,24.853367,1.518,"ASML détient un quasi-monopole (>90% de parts de marché) dans les machines de lithographie EUV, essentielles pour produire les semi-conducteurs les plus avancés. Les revenus proviennent des ventes de systèmes (71%), des services/mise à niveau (29%), avec une marge brute d'environ 50%. Géographiquement, l'Asie domine avec Taiwan (41%) et la Corée du Sud (25%), suivis par la Chine (15%) et les États-Unis (10%). Le modèle économique repose sur des relations clients très étroites (TSMC, Samsung, Intel) et d'importants investissements R&D (4 milliards €/an) créant des barrières à l'entrée considérables.
Risque principal : La forte dépendance aux tensions géopolitiques entre la Chine et l'Occident, avec des restrictions potentielles sur les exportations de technologies avancées qui pourraient impacter significativement les ventes."
United States,Telecom Services,Communication Services,NYQ,AT&T Inc.,T,USD,USD,24.54,24.605,24.6,24.94,24.54,24.88,15.94,24.98,23.088,20.5837,25376692.0,36171621,43901320,178538872832,7176000000,0.62334,1.4627141,324287561728,0.07419,1.7440068,2.657,7.582,1.11,0.048899997,0.90239996,7.08,0.278,,8849999872,1.49,2.24,,-0.005,0.59907,0.35042998,0.23618999,0.04033,0.08759,2647000064,0.369,148002996224,125.151,14.266,0.42,0.733,73122996224,17564999680.0,38252998656.0,32.0,15.49,26.77269,28.0,1.92857,buy,26.0,1324:1000,1649635200.0,0.44183314,0.73,16.697987,11.087394,4.1685,"AT&T est l’un des principaux opérateurs télécoms aux États-Unis, recentré sur la connectivité depuis la scission de WarnerMedia en 2022. En 2024, son chiffre d’affaires provient à 70 % des services sans fil, avec 72 millions de clients postpayés et 17 millions de clients prépayés, soutenus par un réseau 5G couvrant 290 millions d’Américains. La connectivité fixe représente 30 % des revenus, incluant 14 millions d’abonnés à l’Internet haut débit résidentiel et des services filaires aux entreprises (15 % du total). Son activité internationale reste marginale, avec 4 % des revenus issus du Mexique, où elle dessert 23 millions de clients.
AT&T mise sur un modèle récurrent d’abonnements, assurant une certaine stabilité financière. Le groupe accélère l’expansion de la fibre optique, visant 50 millions de foyers couverts d’ici 2029, et intègre l’IA pour améliorer l’efficacité opérationnelle et réduire les coûts.
Risque principal : AT&T fait face à une forte concurrence de Verizon et T-Mobile, pesant sur ses marges. Son endettement élevé (120 milliards $ en 2024) limite sa flexibilité financière et sa capacité d’investissement."
United States,Software - Infrastructure,Technology,NMS,Adobe Inc.,ADBE,USD,USD,433.07,439.38,439.0,453.37,433.07,451.1,403.75,626.35,460.5512,501.8059,3411083.0,3977361,3563470,196363829248,435300000,0.85663,9.374318,240642179072,0.25588,13.801437,11.488,29.585,,,,0.12,0.0065,0.2,5360000000,12.34,20.55,0.233,0.106,0.88657,0.38831002,0.36834,0.15969,0.35355,7514999808,17.072,6078000128,41.788,32.685,0.966,1.111,18570999808,6618500096.0,6732000256.0,660.0,425.0,573.3423,590.0,1.92308,buy,35.0,2:1,1116892800.0,-0.29218423,1.299,36.555916,19.554712,1.5182,"Adobe domine le marché des logiciels créatifs avec un modèle basé sur l’abonnement et une forte présence dans le cloud. Son chiffre d’affaires repose sur trois divisions : Digital Media, qui représente 74 % des revenus avec Creative Cloud et Document Cloud, Digital Experience, qui génère 25 % via des solutions pour les entreprises, et une part marginale issue d’autres activités.
L’entreprise réalise 60 % de son chiffre d’affaires en Amérique du Nord, 26 % en Europe et Moyen-Orient-Afrique, et 14 % en Asie-Pacifique. Son succès repose sur des revenus récurrents, une position dominante avec des logiciels incontournables comme Photoshop et Illustrator, et une forte intégration de l’intelligence artificielle, notamment via Firefly.
Risque principal : La montée en puissance d’alternatives moins coûteuses, comme Canva ou DaVinci Resolve, et les défis réglementaires liés à l’IA pourraient fragiliser sa position sur certains segments."
Ireland,Rental & Leasing Services,Industrials,NYQ,AerCap Holdings N.V.,AER,USD,USD,97.75,98.0,96.695,97.7996,97.75,96.84,75.83,100.81,95.9906,93.90955,453035.0,977818,1071260,18373550080,189731008,0.91067004,2.3503835,62751080448,0.32406,1.0681785,8.027,15.397,1.0,0.010199999,0.0403,,0.25,-0.661,2533252096,12.4,12.24,-0.599,0.03,0.57967997,0.52136004,0.46147,0.034760002,0.153,3810194944,20.62,48498540544,289.501,90.659,1.534,1.982,4531476992,-1829526400.0,5551903232.0,130.0,103.0,112.77778,113.0,1.55556,buy,9.0,,,0.25788188,1.829,7.8096776,7.9953036,,"AerCap est le plus important opérateur du leasing d’avions commerciaux, avec un modèle économique fondé sur l’acquisition et la location longue durée d’appareils. Ses revenus proviennent majoritairement de la location d’avions (85 %), complétés par la vente d’appareils (10 %) et les services de maintenance et autres activités (5 %). L’entreprise opère dans le monde entier, avec une répartition géographique équilibrée : 30 % des revenus en Europe, 28 % en Asie-Pacifique, 24 % en Amérique du Nord et 18 % dans le reste du monde.
Ses principaux atouts résident dans une flotte moderne de plus de 1 700 appareils, des contrats de location à long terme garantissant des flux de trésorerie stables, ainsi qu’une large diversification de sa clientèle, avec plus de 300 compagnies aériennes dans 80 pays. Son poids sur le marché lui permet également d’obtenir des conditions avantageuses auprès des constructeurs comme Airbus et Boeing.
Risque principal : L’entreprise reste exposée aux cycles économiques et aux crises du transport aérien, qui peuvent affecter la demande pour ses appareils. Son niveau d’endettement élevé et sa dépendance aux conditions de financement, notamment aux taux d’intérêt, constituent également des risques, tout comme les litiges en cours, notamment sur les avions bloqués en Russie."
United States,Specialty Chemicals,Basic Materials,NYQ,"Air Products and Chemicals, Inc.",APD,USD,USD,310.44,310.7,303.92,311.06,310.44,310.75,216.3,341.14,312.7782,288.3048,2372687.0,1496666,2070330,69134417920,222476000,0.90792,5.713305,87717486592,0.31636,4.060287,7.249,20.416,7.16,0.0215,0.4095,2.27,1.77,1.815,3842099968,17.29,14.17,1.81,-0.001,0.32493,0.35507,0.25791,0.049689997,0.2258,2984699904,13.408,14905799680,79.822,76.534,1.296,1.522,3931899904,-3224012544.0,3646700032.0,395.0,300.0,355.64,353.09,2.0,buy,22.0,1081:1000,1475452800.0,0.3946718,0.826,17.972816,22.151478,11.4818,"Air Products est l’un des leaders mondiaux des gaz industriels, avec un modèle économique reposant sur des contrats à long terme et une forte présence dans la transition énergétique. L’entreprise génère ses revenus principalement en Amérique (41 %), suivie par l’Asie (26 %), l’Europe (23 %) et le Moyen-Orient/Inde (1 %). Son activité se divise entre la fourniture de gaz industriels essentiels (oxygène, azote, hydrogène), les équipements de production et de stockage, ainsi que les solutions pour l’hydrogène propre.
Grâce à ses contrats de 15 à 20 ans avec des industries stratégiques, Air Products bénéficie de revenus stables et prévisibles. Son réseau de pipelines et d’usines lui confère une forte présence sur le marché, tandis que son leadership dans l’hydrogène bas-carbone renforce son rôle dans la transition énergétique.
Risque principal : L’entreprise est confrontée à des défis liés aux investissements massifs nécessaires pour développer l’hydrogène propre et à la dépendance aux cycles industriels, notamment dans la sidérurgie et la pétrochimie, ce qui peut affecter sa rentabilité à long terme."
United States,Internet Content & Information,Communication Services,NMS,Alphabet Inc.,GOOGL,USD,USD,185.34,187.39,185.86,188.2,185.34,186.47,130.67,207.05,189.5972,174.76045,21586618.0,29066720,36111460,2283026776064,5832999936,0.80603,6.7175703,2462356602880,0.27738002,7.2802873,7.245,19.943,0.8,0.004,0.0531,,0.2,0.336,94268997632,8.04,8.96,0.366,0.151,0.58127,0.36330003,0.32312,0.16483,0.32101002,93229998080,7.616,29289000960,9.324,25.613,1.761,1.95,197550997504,41104498688.0,105101000704.0,240.0,151.0,217.54446,220.0,1.60938,buy,47.0,20:1,1658102400.0,0.25628686,1.034,23.192787,18.21126,1.3363,"Alphabet Inc., maison mère de Google, repose sur un modèle solide, diversifié et en croissance. La publicité en ligne représente 72 % de ses revenus, portée par Google Search et YouTube. Google Cloud connaît une forte expansion, atteignant 12 % du chiffre d’affaires en 2024, grâce à la demande en solutions cloud.
L’entreprise se diversifie progressivement avec des abonnements (YouTube Premium, Google One), des appareils (Pixel, Nest) et des projets innovants (Waymo, DeepMind), réduisant ainsi sa dépendance à la publicité. Son empreinte géographique est équilibrée, avec 49 % des revenus aux États-Unis, 29 % en Europe et 16 % en Asie-Pacifique.
L’innovation reste un moteur clé, notamment dans l’intelligence artificielle. 
Risque princcipal : Alphabet reste exposé aux risques réglementaires et à la concurrence, tandis que les coûts élevés du cloud et de l’IA pèsent sur sa rentabilité. "
United States,Internet Retail,Consumer Cyclical,NMS,"Amazon.com, Inc.",AMZN,USD,USD,229.15,230.545,229.2,233.915,229.15,233.14,151.61,242.52,225.4602,195.83755,32330701.0,37225751,42936840,2470747570176,10597699584,0.64438003,3.9842544,2581784166400,0.080419995,9.456094,4.163,23.138,,,,,,0.552,49868001280,5.52,6.15,0.521,0.11,0.48406,0.17994,0.109589994,0.07069,0.22558,88050999296,8.374,158534991872,61.175,24.655,0.827,1.089,300180013056,54328250368.0,112706002944.0,306.0,207.0,263.10318,268.0,1.36765,strong_buy,63.0,20:1,1654473600.0,0.32963908,1.146,42.235508,30.72086,1.7515,"Amazon est un acteur incontournable du commerce en ligne, du cloud computing et de la publicité numérique. Son modèle économique repose sur plusieurs piliers stratégiques. Le e-commerce représente environ 45 % des revenus, avec une domination en Amérique du Nord où Amazon détient 61 % de part de marché. L’abonnement Prime renforce la fidélisation des clients et stimule les ventes. AWS (Amazon Web Services), leader du cloud computing, génère 17 % des revenus mais contribue à plus de 70 % des profits, affichant une croissance rapide (+19 % sur un an). La publicité, en plein essor, représente environ 8 % des revenus, tandis que d’autres services comme Prime Video, Alexa et les magasins Whole Foods complètent l’offre.
L’entreprise bénéficie d’une forte diversification et d’une présence géographique équilibrée, avec 61 % des revenus en Amérique du Nord, 23 % à l’international et 17 % via AWS. Cette répartition lui permet d’atténuer les risques liés à une seule région ou activité. Son investissement massif dans l’innovation et l’intelligence artificielle renforce son avantage compétitif, notamment dans l’optimisation logistique et le cloud.
Risque principal :  Amazon fait face à plusieurs risques majeurs. Son activité e-commerce, très capitalistique, affiche des marges réduites, tandis que la concurrence dans le cloud computing s’intensifie avec Microsoft Azure et Google Cloud. De plus, l’entreprise est soumise à une pression réglementaire croissante sur ses pratiques commerciales et ses activités publicitaires, pouvant impacter sa rentabilité et son expansion."
United States,Banks - Diversified,Financial Services,NYQ,Bank of America Corporation,BAC,USD,USD,47.4,47.48,46.4,47.55,47.4,46.675,32.35,48.08,45.9566,41.8287,20047692.0,34023108,32007130,355236872192,7610860032,0.63408,3.7541149,357865619456,0.24952,1.3195839,3.782,,1.04,0.0221,0.35509998,2.45,0.26,-0.116,21941999616,3.21,3.66,-0.1,-0.005,,,0.30769,0.0072899996,0.08092,827766996992,107.882,799686000640,,35.371,,,94625996800,,-1995000064.0,59.0,43.0,52.59524,53.0,1.68182,buy,21.0,2:1,1093824000.0,0.40987504,1.325,14.540498,10.764654,1.7793,"Bank of America combine diversification, innovation et solidité financière. Son modèle demeure attractif pour les investisseurs grâce à une rentabilité élevée et une politique de retour aux actionnaires. C’est l'une des principales banques américaines, avec un modèle économique reposant sur quatre divisions clés. Consumer Banking représente 35 % des revenus et inclut les services aux particuliers, les cartes de crédit et les prêts. Cette division gère plus de 4 100 agences et 16 000 guichets automatiques. Global Banking génère 25 % des revenus en proposant des services aux entreprises et de gestion de trésorerie, couvrant 75 % des entreprises du Fortune 500. Global Markets contribue à hauteur de 20 %, avec une forte présence en trading et marchés des capitaux, notamment en actions et obligations. Wealth Management représente 20 % des revenus, via Merrill, avec 3 000 milliards de dollars d’actifs sous gestion.
La banque génère 85 % de ses revenus aux États-Unis et détient 16 % du marché des dépôts de détail. Elle bénéficie d'une forte adoption numérique avec 55 millions d’utilisateurs et détient plus de 5 000 brevets dans les paiements mobiles, la cybersécurité et l’intelligence artificielle.
Risque principal : Bank of America est sensible aux taux d’intérêt et aux cycles économiques. Elle fait face à une réglementation accrue après les crises bancaires récentes, ainsi qu’à une concurrence croissante des fintechs et néobanques sur les services numériques."
France,Diagnostics & Research,Healthcare,PAR,bioMérieux S.A.,BIM.PA,EUR,EUR,113.3,113.1,112.7,115.6,113.3,115.0,88.25,117.6,106.278,101.16825,82922.0,99208,95684,13669590016,117929000,0.20809999,3.5911176,13668657152,0.10805,3.5086648,3.591,15.829,0.85,0.0075,0.245,0.64,0.85,0.332,411300000,3.47,4.57,0.341,0.074,0.55718,0.22684999,0.15159,0.07083,0.10609,272200000,2.307,558499968,14.394,32.776,1.199,2.21,2120899968,180712496.0,494600000.0,132.0,90.0,121.53333,129.0,1.93333,buy,15.0,3:1,1505865600.0,0.10428846,0.219,33.14121,24.96662,1.4506,"BioMérieux est un leader mondial du diagnostic in vitro, spécialisé dans la microbiologie, la biologie moléculaire, les immunoessais et les applications industrielles. 
BioMérieux a réalisé un chiffre d'affaires de 3,7 milliards d'euros en 2023, soit une augmentation de 40 % par rapport à 2019. Le résultat opérationnel courant avant éléments non récurrents (CEBIT) s'est élevé à 610 millions d'euros, soit une augmentation de 50 % par rapport à 2019.   
Innovation continue : la société investit 12 % de son chiffre d'affaires dans la recherche et le développement. Elle dispose d'un solide portefeuille de produits innovants, tels que les panels non respiratoires BIOFIRE, le système SPOTFIRE et la plateforme VITEK.   Forte présence internationale : BioMérieux réalise 44 % de son chiffre d'affaires en Amérique du Nord, 32 % en Europe, au Moyen-Orient et en Afrique, 17 % en Asie-Pacifique et 6 % en Amérique latine. 
Risque principal : Concurrence accrue sur le marché du diagnostic in vitro. Tout ralentissement de la croissance de ce marché pourrait avoir un impact négatif sur les résultats de BioMérieux.   "
France,Consulting Services,Industrials,PAR,Bureau Veritas SA,BVI.PA,EUR,EUR,29.18,29.16,29.16,29.56,29.18,29.56,24.46,31.54,29.5396,28.6379,1049645.0,1006713,1109040,13357986816,448512992,0.41956002,2.229229,14657814528,0.084359996,8.125343,2.446,13.365,0.83,0.028399998,0.7545,2.62,0.83,0.008,505500000,1.1,1.48,-0.002,0.042,0.29787,0.18302,0.13325,0.07989,0.29916,1529500032,3.414,3045900032,179.403,3.638,1.314,1.329,1784899968,735962496.0,860000000.0,40.0,28.5,33.6,34.0,1.94118,buy,17.0,4:1,1371772800.0,0.17282963,0.868,26.872726,19.620207,2.448,"Bureau Veritas est un leader mondial des services de Test, Inspection et Certification (TIC), avec un modèle économique diversifié et résilient. L’entreprise structure son activité autour de quatre pôles majeurs :
Industrie & Infrastructures (54 % du CA) : Comprend la construction (21 %), l’industrie (20 %), la certification (7 %) et la santé-sécurité-environnement (HSE, 6 %).
Biens de consommation (20 %) : Tests et certifications pour garantir la conformité des produits vendus à travers le monde.
Agroalimentaire & Matières premières (18 %) : Sécurisation de la chaîne alimentaire et analyse des matières premières.
Marine & Offshore (8 %) : Inspection et classification des navires et plateformes offshore.
L’entreprise bénéficie d’une forte diversification sectorielle et géographique, avec une répartition équilibrée de son chiffre d’affaires entre l’Europe (33 %, dont 14 % en France), l’Asie-Pacifique (31 %), les Amériques (25 %) et l’Afrique/Moyen-Orient (11 %). Cette implantation mondiale lui permet d’atténuer les risques économiques locaux et de capter la demande croissante liée aux réglementations internationales. Bureau Veritas se distingue par une forte récurrence des revenus (80 % de contrats renouvelables) et des marges opérationnelles solides (~15 %).
Principaux risques : Dépendance aux cycles économiques industriels, qui peuvent impacter la demande en certifications et inspections. Concurrence accrue sur le marché des TIC, pouvant peser sur la croissance organique. Risque réputationnel : une faille dans la qualité des certifications pourrait affecter la confiance des clients et impacter significativement l’activité."
Canada,Aerospace & Defense,Industrials,NYQ,CAE Inc.,CAE,USD,CAD,23.8,23.89,23.7,24.27,23.8,24.06,15.95,25.53,23.8646,20.02195,251583.0,511153,557880,7665275392,318590016,0.73208,1.7303497,10729424896,-0.07379,1.7491821,2.422,14.718,,,,1.4,0.08,-0.101,-345500000,-0.75,0.99,-0.095,0.082,0.26048002,0.16455999,0.11226,0.02787,-0.07368,179700000,0.564,3244600064,72.68,13.755,0.551,0.841,1153900032,338887488.0,585200000.0,28.067244,18.68307,23.375156,23.375156,2.61538,hold,2.0,,,0.10904002,1.914,,16.688631,,"CAE est l'acteur incontournable des technologies de simulation et de formation pour les secteurs de l’aviation civile, de la défense et de la sécurité. Son modèle repose sur l’innovation en simulation, l’expansion des services de formation et la gestion des commandes à long terme.
En 2024, CAE a généré un chiffre d’affaires de 2,21 milliards CAD sur les six premiers mois (+7 % vs 2023) et un bénéfice net de 105,6 millions CAD. Son activité se divise en deux segments. Aviation civile (56 % du CA, 1,23 milliard CAD), portée par la vente de simulateurs de vol (+27 unités commandées sur six mois) et la formation des pilotes. La division Défense et sécurité (44 % du CA, 980,8 millions CAD) connaît une croissance de 3 %, avec des commandes records grâce au contrat FAcT de 25 ans pour l’entraînement des forces aériennes canadiennes (1,7 milliard CAD ajouté au carnet de commandes).
Géographiquement, CAE réalise 41 % de ses revenus en Amérique du Nord, 29 % en Europe, 14 % en Asie-Pacifique et 16 % ailleurs. L’entreprise bénéficie d’un carnet de commandes record de 18 milliards CAD (+53 % vs 2023) et continue d’investir dans l’expansion de ses centres de formation, notamment via l’acquisition majoritaire de SIMCOM Aviation Training pour 230 millions USD.
Risque principal : CAE est exposé aux cycles de dépenses en aviation et défense, à la concurrence accrue dans la simulation et aux défis liés aux contrats fixes hérités de la période pré-COVID. Son succès repose sur la croissance de la formation récurrente et l’exécution efficace des nouveaux contrats militaires."
Canada,Railroads,Industrials,NYQ,Canadian Pacific Kansas City Limited,CP,USD,CAD,77.18,77.32,76.97,78.14,77.18,78.11,70.89,91.58,75.6674,79.29495,1243314.0,3321830,4695040,72915689472,933500032,0.75753,5.0467668,95972909056,0.24502,1.6514441,6.643,12.611,0.53,0.0067000003,0.2005,0.79,0.141,0.073,3540000000,2.78,3.6,0.071,0.063,0.53634,0.52672,0.37418997,0.04397,0.08088,463000000,0.496,21913999360,48.611,47.298,0.415,0.53,7749000192,2288624896.0,4901000192.0,100.95344,71.74053,88.56935,90.75422,1.84848,buy,16.0,5:1,1620950400.0,-0.08532828,0.789,28.097122,13.884692,,"CPKC (Canadian Pacific Kansas City) est le premier chemin de fer reliant directement le Canada, les États-Unis et le Mexique, offrant une infrastructure unique pour le transport de marchandises en Amérique du Nord. Son modèle économique repose sur l’efficacité opérationnelle et l’expansion de son réseau après la fusion entre Canadian Pacific et Kansas City Southern.
Le groupe a généré 14,5 milliards CAD de revenus en 2024 (+16 %). Son chiffre d’affaires se répartit ainsi : Bulk (grains, charbon, potasse) en forte croissance, Merchandise (produits chimiques, métaux, automobiles) et Intermodal (conteneurs). L’Intermodal, bien que clé pour la connectivité entre les trois pays, a été impacté par des perturbations logistiques et climatiques.
La répartition géographique est bien équilibrée grâce à son corridor nord-sud, favorisant le commerce entre les trois pays. L’entreprise a affiché un ratio d’exploitation de 64,4 % en 2024 et vise une amélioration grâce aux synergies post-fusion et aux investissements dans son réseau.
Risque principal : CPKC est exposé aux fluctuations des prix des matières premières, aux perturbations climatiques et aux régulations gouvernementales aux États-Unis et au Mexique, pouvant impacter son activité. Son niveau d’endettement et la rentabilité attendue des synergies de la fusion seront également des éléments à surveiller."
